Наименование ,Ссылка,Стоимость на 30 кв.м,Акт работ выдают?,Доп. комментарий
Алексей / Частный мастер,https://www.avito.ru/brands/i201820503/all?iid=3157386735&page_from=from_item_messenger&sellerId=8a6a1479d61fbffb1d4b74b418ae1171,6000 руб,да,лицензия есть. у него больше всего отзывов из всех 
Эль-групп,https://www.avito.ru/brands/i46738071/all/predlozheniya_uslug?iid=2645236955&page_from=from_item_messenger&sellerId=2c6cc6d0afc599b4f69db13feff65f2b,4000 руб делают орошением,да,"заключать нужно договор 
есть лицензия

Орошением это электрический распылитель прямого действия. Сказали что для кафе больше этот вариант рекомендуют"
Дезинфекция СЭС услуги N1 в Крыму,https://www.avito.ru/brands/i263541246/all?iid=4668410223&page_from=from_item_messenger&sellerId=5da062bf4e07697df90ed81b65a13514,от 5000 руб,да,"Акт сделают от заднего числа
так как они ещё только в процессе получения лицензии
можно заключить договор с фирмой и раз в квартал они могут проводить дезинсекцию при необходимости"
Дезсервис Крым,https://www.avito.ru/brands/f165125f74483fb2899f9da606fe290b/all?iid=4539622140&page_from=from_item_messenger&sellerId=9e34f248af49601a80fdb8f891c6ced6,4500 руб,да,"Есть лицензия
можно заключить стандартный договор на годовое обслуживание, обработки проводятся и оплачиваются согласно заявкам. Обработали - оплатили, если не проводилась обработка соответственно оплачивать не нужно. 
У каждого предприятия общепита должен быть такой договор об обслуживании и журнал о проведении обработок согласно СанПиН
Наподобие договора с охраной и вывозом мусора."
Городская служба дезинфекции,https://www.avito.ru/brands/professional1984/all/predlozheniya_uslug?iid=4066897503&page_from=from_item_messenger&sellerId=27997621d2aa1e271b5d24a7f4089b73,4000 руб,да,"Лицензия у нас есть. Если оплату делаем по безналу, то нужны будут наши реквизиты для составления договора. Предоставляют счёт и акт выполненных работ.
Как правило кафе, рестораны заключают годовой договор и ежемесячно проводят обработки если есть проблемы с насекомыми"